{
  "schema_version": 1,
  "run_id": "6fac055ad841",
  "parent_run_id": null,
  "project": "C:\\Users\\Lin\\Desktop\\Programs\\MathModel\\research\\P15\\k004\\results\\ref_RT_2018_A_s137",
  "questions": [
    "2018_A"
  ],
  "status": "failed",
  "workflow_version": "ea2af38e9ca484dd31b7b2a0aaea56d1fbd9dcbd4a7f8c5144576638f3542be0",
  "skill_version": "eaa08b313d5c71539dc81c20a3c19decc768ba14c44552579a9ce709dd290e91",
  "tool_version": "catalog-v5@aac55a8d7",
  "model_provider": null,
  "model_version": null,
  "prompt_hash": "ea2af38e9ca484dd31b7b2a0aaea56d1fbd9dcbd4a7f8c5144576638f3542be0",
  "input_hash": "c3a197c106d00a24642d2687126f56da12669ea8c17cf1dd1c286fd520c03ef3",
  "artifact_hash": "cc01c9abbae8c144128ca51d4b53a8c55b5fb7d7fb9e9beeb90241f7c9544b51",
  "evidence_hash": "d2b72328171aafce5e5159da0acea3527d2fa472d9299a12d6170a18fdc1df21",
  "decision_log_hash": "d7027ec2253d3a08560b2d1618b3cf73042fa0b9cee045ad423dfac24154c616",
  "latency": {
    "started_at": "2026-09-10T04:32:33Z",
    "finished_at": "2026-09-10T04:32:33Z",
    "seconds": 0.04
  },
  "started_at": "2026-09-10T04:32:33Z",
  "token_cost": null,
  "engine": {
    "completed_nodes": 3,
    "retries": 1,
    "failures": [
      "model_construction"
    ]
  },
  "decision": null
}