{
  "schema_version": 1,
  "run_id": "f4ff42147f3c",
  "parent_run_id": null,
  "project": "C:\\Users\\Lin\\Desktop\\Programs\\MathModel\\research\\P15\\k004\\results\\_debug2",
  "questions": [
    "2024_A"
  ],
  "status": "failed",
  "workflow_version": "ea2af38e9ca484dd31b7b2a0aaea56d1fbd9dcbd4a7f8c5144576638f3542be0",
  "skill_version": "eaa08b313d5c71539dc81c20a3c19decc768ba14c44552579a9ce709dd290e91",
  "tool_version": "catalog-v5@aac55a8d7",
  "model_provider": null,
  "model_version": null,
  "prompt_hash": "ea2af38e9ca484dd31b7b2a0aaea56d1fbd9dcbd4a7f8c5144576638f3542be0",
  "input_hash": "c3a197c106d00a24642d2687126f56da12669ea8c17cf1dd1c286fd520c03ef3",
  "artifact_hash": "6697bac3cc34fc0e8d778c0f7b61266e307cb79618eaf14a3a3b766b4f35b7a6",
  "evidence_hash": "15f9cdf682d1434943241bb62b28b38b0fa4977251172030e8f39148f2e9ce78",
  "decision_log_hash": "1a7ec1ffd675c1931b79ab8179087dedbda63eecae9d38cd6aff10e67d5fd6f5",
  "latency": {
    "started_at": "2026-09-10T04:33:22Z",
    "finished_at": "2026-09-10T04:33:22Z",
    "seconds": 0.09
  },
  "started_at": "2026-09-10T04:33:22Z",
  "token_cost": null,
  "engine": {
    "completed_nodes": 3,
    "retries": 1,
    "failures": [
      "model_construction"
    ]
  },
  "decision": null
}