{
  "schema_version": 1,
  "run_id": "8b5752e652d6",
  "parent_run_id": null,
  "project": "C:\\Users\\Lin\\Desktop\\Programs\\MathModel\\research\\P15\\k004\\results\\ref_RT_2017_B_s42",
  "questions": [
    "2017_B"
  ],
  "status": "failed",
  "workflow_version": "ea2af38e9ca484dd31b7b2a0aaea56d1fbd9dcbd4a7f8c5144576638f3542be0",
  "skill_version": "eaa08b313d5c71539dc81c20a3c19decc768ba14c44552579a9ce709dd290e91",
  "tool_version": "catalog-v5@aac55a8d7",
  "model_provider": null,
  "model_version": null,
  "prompt_hash": "ea2af38e9ca484dd31b7b2a0aaea56d1fbd9dcbd4a7f8c5144576638f3542be0",
  "input_hash": "c3a197c106d00a24642d2687126f56da12669ea8c17cf1dd1c286fd520c03ef3",
  "artifact_hash": "cd6b87b2ed610b8e1f756d99355aec5f4ac61d1f0925f0e8d6e973596826eaff",
  "evidence_hash": "193802e031c39eba641c978241634236452ed6545b7bde8cc3fe15c955835df2",
  "decision_log_hash": "d7027ec2253d3a08560b2d1618b3cf73042fa0b9cee045ad423dfac24154c616",
  "latency": {
    "started_at": "2026-09-10T04:32:33Z",
    "finished_at": "2026-09-10T04:32:33Z",
    "seconds": 0.05
  },
  "started_at": "2026-09-10T04:32:33Z",
  "token_cost": null,
  "engine": {
    "completed_nodes": 3,
    "retries": 1,
    "failures": [
      "model_construction"
    ]
  },
  "decision": null
}